{
  "project": "wannabuild-dryrun-resume",
  "mode": "standard",
  "current_phase": "implement",
  "phase_status": "in_progress",
  "public_stage": "implement",
  "workflow_status": "in_progress",
  "control_mode": "autonomous",
  "artifacts": {
    "requirements": ".wannabuild/spec/requirements.md",
    "design": ".wannabuild/spec/design.md",
    "tasks": ".wannabuild/spec/tasks.md"
  },
  "started_at": "2026-02-20T09:00:00Z",
  "updated_at": "2026-02-20T10:12:00Z",
  "phase_history": [
    {
      "phase": "requirements",
      "status": "complete",
      "timestamp": "2026-02-20T09:10:00Z"
    },
    {
      "phase": "design",
      "status": "complete",
      "timestamp": "2026-02-20T09:18:00Z"
    },
    {
      "phase": "tasks",
      "status": "complete",
      "timestamp": "2026-02-20T09:24:00Z"
    }
  ],
  "public_stage_history": [
    {
      "stage": "discover",
      "status": "complete",
      "timestamp": "2026-02-20T09:05:00Z"
    },
    {
      "stage": "plan",
      "status": "complete",
      "timestamp": "2026-02-20T09:22:00Z"
    },
    {
      "stage": "implement",
      "status": "in_progress",
      "timestamp": "2026-02-20T10:12:00Z"
    }
  ]
}
