{
  "project": "wannabuild-dryrun-standard-missing-design",
  "mode": "standard",
  "current_phase": "implement",
  "phase_status": "in_progress",
  "public_stage": "implement",
  "workflow_status": "in_progress",
  "control_mode": "autonomous",
  "artifacts": {
    "requirements": ".wannabuild/spec/requirements.md",
    "tasks": ".wannabuild/spec/tasks.md"
  },
  "started_at": "2026-02-20T11:00:00Z",
  "updated_at": "2026-02-20T11:14:00Z",
  "phase_history": [
    {
      "phase": "requirements",
      "status": "complete",
      "timestamp": "2026-02-20T11:05:00Z"
    },
    {
      "phase": "tasks",
      "status": "complete",
      "timestamp": "2026-02-20T11:12:00Z"
    },
    {
      "phase": "implement",
      "status": "in_progress",
      "timestamp": "2026-02-20T11:14:00Z"
    }
  ],
  "public_stage_history": [
    {
      "stage": "discover",
      "status": "complete",
      "timestamp": "2026-02-20T11:02:00Z"
    },
    {
      "stage": "plan",
      "status": "complete",
      "timestamp": "2026-02-20T11:10:00Z"
    },
    {
      "stage": "implement",
      "status": "in_progress",
      "timestamp": "2026-02-20T11:14:00Z"
    }
  ]
}
